{
  "schema_version": "titan_pilot_contract_2026-08-23_v1",
  "pilot_id": "titan_crypto_momentum",
  "display_name": "Titan Crypto Momentum Research",
  "decision_contract_version": "titan_crypto_momentum_2026-08-23_v1",
  "strategy_version": "titan_shadow_pilots_2026-08-23_v1",
  "provenance": {
    "canonical_path": "config/pilots/titan-crypto-momentum.json",
    "owner": "Trader Brain Research",
    "reviewer": "UNASSIGNED_INDEPENDENT_REVIEWER",
    "approval_authority": "EXPLICIT_USER_VERSIONED_AUTHORIZATION_REQUIRED_FOR_ANY_LIVE_PROMOTION",
    "supersedes": null,
    "superseded_by": null,
    "immutable_exact_bytes": true,
    "hash_algorithm": "SHA-256"
  },
  "status": "SHADOW_ONLY",
  "allowed_book_modes": [
    "SHADOW"
  ],
  "broker_authority": false,
  "trade_authority": false,
  "truth_authorities": {
    "market_data": "MASSIVE_DATA_ONLY",
    "broker_state": "ROBINHOOD_ONLY",
    "live_fills": "ROBINHOOD_CONFIRMED_ONLY",
    "paper_fills": "SIMULATION_MODEL_ONLY",
    "shadow_outcomes": "CAUSAL_COUNTERFACTUAL_ONLY"
  },
  "causal_inputs": {
    "data_dependencies": [
      "causal 24/7 crypto trades, quotes, venue, pair, reference, and market-regime data",
      "verified Robinhood crypto account, jurisdiction, tradable-pair, quote, review, order, fill, custody, and fee capabilities for any future live contract",
      "explicit exchange, stablecoin, fork, maintenance, and market-wide event context"
    ],
    "decision_time_rule": "Freeze venue, pair, quote, liquidity, regime, and event evidence at each research timestamp.",
    "completed_bar_rule": "Use a separately versioned 24/7 bar/session clock; equity completed-bar, open, gap, and holiday rules may not be transferred.",
    "missing_data_rule": "Venue, pair, account, jurisdiction, fee, spread, or 24/7 risk inputs remain UNKNOWN and prohibit executability claims.",
    "future_information_allowed": false
  },
  "decision_rules": {
    "implementation_status": "SHADOW_NOT_IMPLEMENTED",
    "setup_rules": [
      "UNKNOWN until a causal 24/7 session model, liquidity regime, momentum transition, and market-wide correlation model are versioned",
      "equity gap, opening-range, and same-clock RVOL definitions are not admissible"
    ],
    "entry_or_research_rules": [
      "research observations only; no broker review, crypto order, risk authorization, buying-power reservation, or allocation",
      "freeze venue/pair intersection, trigger, quote, spread, depth, fee, invalidation, and horizon at T"
    ],
    "exit_or_outcome_rules": [
      "UNKNOWN until continuous monitoring, maintenance, weekend, outage, gap, and execution models are prospectively defined",
      "outcomes must remain venue- and pair-specific and include all fees and executable spread/slippage"
    ],
    "invalidations": [
      "venue or pair mismatch, jurisdiction or account ineligibility, stale or fragmented quote, maintenance, stablecoin depeg, failed liquidity, or undefined 24/7 monitoring",
      "any attempted LIVE, PAPER, broker, risk, or allocation action under this SHADOW-only contract"
    ]
  },
  "instrument_scope": {
    "research_only": true,
    "included": [
      "crypto_momentum_and_liquidity_research",
      "twenty_four_hour_session_regime_research"
    ],
    "excluded": [
      "broker_order",
      "live_crypto_position",
      "capital_reservation",
      "automatic_promotion"
    ],
    "notes": [
      "Connector, account, jurisdiction, tradable-pair, quote, and 24/7 risk readiness are unverified.",
      "This contract cannot authorize crypto trading."
    ]
  },
  "lane_risk_translation": {
    "status": "UNKNOWN_NOT_ACTIVATED",
    "notional_rule": "UNKNOWN; no crypto quantity, buying power, custody balance, or capital is authorized or reserved.",
    "stop_defined_risk_rule": "UNKNOWN until venue-specific stop support, continuous quote availability, and outage behavior are verified.",
    "stress_loss_rule": "Must model weekend gaps, fragmented liquidity, venue outage, depeg, fork, maintenance, and correlated crypto drawdown tails.",
    "lane_adjustments": [
      "separate each venue/pair, stablecoin quote currency, liquidity tier, and weekday/weekend regime",
      "use 24/7 time-of-week baselines rather than equity-session RVOL",
      "no equity loss-lock or closeout assumption is transferable without a new crypto-specific contract"
    ]
  },
  "cost_execution_model": {
    "status": "UNKNOWN_NOT_IMPLEMENTED",
    "quote_source": "UNKNOWN until a venue-specific executable Robinhood crypto quote workflow is verified.",
    "spread_model": "UNKNOWN; consolidated or third-party market data cannot prove the executable broker spread.",
    "slippage_model": "UNKNOWN; must include fragmentation, weekend, outage, depeg, and liquidation-wave slippage.",
    "fee_model": "UNKNOWN; must include exact broker spread/fee treatment and may not silently assume zero.",
    "fill_model": "UNKNOWN; venue-specific order behavior and partial fills must be causally modeled.",
    "maximum_contractual_loss_rule": "Long spot maximum nominal loss is deployed notional, but stress, custody, venue, and depeg risks must be reported separately."
  },
  "session_calendar_rules": {
    "timezone": "UTC_AND_AMERICA_NEW_YORK_RESEARCH_LABELS",
    "calendar": "Continuous 24/7 crypto calendar with venue maintenance and time-of-week regimes",
    "research_or_entry_window": "SHADOW research only; no active entry window.",
    "mandatory_flat_rule": "UNKNOWN_NOT_ACTIVATED; any future holding and downtime policy requires a new explicit crypto contract.",
    "holiday_rule": "Equity holidays do not close crypto; holiday and weekend liquidity regimes must be labeled independently."
  },
  "capital_policy": {
    "allocator": "CENTRAL_DYNAMIC_RISK_CONTROLLER",
    "fixed_module_budget": false,
    "live_notional_range_pct": [
      0,
      100
    ],
    "max_unleveraged_buying_power_fraction": 1.0,
    "leverage_allowed": false,
    "leaderboard_can_reallocate_capital": false
  },
  "record_identity": {
    "required_on_record_types": [
      "candidate",
      "decision",
      "campaign",
      "outcome",
      "grade",
      "pretrade_risk_facts"
    ],
    "required_fields": [
      "pilot_id",
      "book_mode",
      "decision_contract_version",
      "decision_contract_hash"
    ],
    "book_mode_enum": [
      "LIVE",
      "PAPER",
      "SHADOW"
    ],
    "contract_hash_rule": "LOWERCASE_SHA256_OF_EXACT_CANONICAL_CONTRACT_FILE_BYTES"
  },
  "suspension_criteria": {
    "entry_or_research_kill_conditions": [
      "venue, pair, account, jurisdiction, custody, fee, or quote workflow unverified",
      "24/7 session, outage, maintenance, or tail-risk model absent",
      "future leakage or equity-model transfer detected",
      "any non-SHADOW book mode or nonzero trade, risk, reservation, or allocation authority"
    ],
    "operator_stop_semantics": "Registered SHADOW research is zero-authority; it cannot alter, release, or bypass the LIVE emergency-entry stop.",
    "automatic_restart_allowed": false
  },
  "evidence_standard": {
    "performance_status": "UNKNOWN_INSUFFICIENT_EVIDENCE",
    "minimum_independent_position_episodes": 100,
    "minimum_trading_sessions": 40,
    "minimum_distinct_underlyings": 30,
    "chronological_holdout_required": true,
    "after_cost_clustered_ci_lower_bound_must_exceed_zero": true,
    "independent_review_required": true,
    "metrics_may_be_unknown": true
  },
  "fact_sheet_rules": {
    "schema_version": "titan_pilot_fact_sheet_2026-08-23_v1",
    "classification": "PRIVATE_TRADER_BRAIN",
    "separate_by_book_mode": true,
    "combined_performance": null,
    "required_metrics": [
      "after_cost_expectancy_r",
      "ticker_session_clustered_95pct_ci",
      "maximum_drawdown_r",
      "profit_factor",
      "win_rate_pct",
      "execution_shortfall_bps",
      "entry_slippage_bps",
      "exit_slippage_bps",
      "effective_independent_sample_size",
      "distinct_ticker_session_count",
      "trading_session_count",
      "distinct_underlying_count",
      "evidence_coverage_pct",
      "policy_hash",
      "decision_contract_hash",
      "known_failure_modes"
    ],
    "forbidden_content": [
      "credentials",
      "raw_broker_payloads",
      "licensed_massive_source_data",
      "cross_book_combined_performance"
    ],
    "authority": "REPORTING_ONLY"
  },
  "promotion_policy": {
    "automatic_live_promotion": false,
    "leaderboard_grants_authority": false,
    "shadow_evidence_required": true,
    "independent_review_required": true,
    "explicit_versioned_authorization_required": true
  },
  "known_failure_modes": [
    "continuous trading makes equity-session assumptions invalid",
    "fragmented venue liquidity can make one feed non-executable",
    "weekend and overnight gaps can exceed modeled exits",
    "account and jurisdiction eligibility can change independently of market data"
  ]
}
