{
  "schema_version": "titan_pilot_contract_2026-08-23_v1",
  "pilot_id": "titan_equity_setup_challengers",
  "display_name": "Titan Equity Setup Challengers",
  "decision_contract_version": "titan_equity_setup_challengers_2026-08-23_v1",
  "strategy_version": "titan_shadow_pilots_2026-08-23_v1",
  "provenance": {
    "canonical_path": "config/pilots/titan-equity-setup-challengers.json",
    "owner": "Trader Brain Research",
    "reviewer": "UNASSIGNED_INDEPENDENT_REVIEWER",
    "approval_authority": "EXPLICIT_USER_VERSIONED_AUTHORIZATION_REQUIRED_FOR_ANY_LIVE_PROMOTION",
    "supersedes": null,
    "superseded_by": null,
    "immutable_exact_bytes": true,
    "hash_algorithm": "SHA-256"
  },
  "status": "SHADOW_ONLY",
  "allowed_book_modes": [
    "SHADOW"
  ],
  "broker_authority": false,
  "trade_authority": false,
  "truth_authorities": {
    "market_data": "MASSIVE_DATA_ONLY",
    "broker_state": "ROBINHOOD_ONLY",
    "live_fills": "ROBINHOOD_CONFIRMED_ONLY",
    "paper_fills": "SIMULATION_MODEL_ONLY",
    "shadow_outcomes": "CAUSAL_COUNTERFACTUAL_ONLY"
  },
  "causal_inputs": {
    "data_dependencies": [
      "causal Massive equity bars, NBBO, volume, same-time-of-day baselines, VWAP, opening range, and market/sector context",
      "point-in-time tradability, security-status, halt, filing, financing, and dilution context",
      "prospectively frozen setup transition, trigger, invalidation, chase ceiling, and outcome horizon"
    ],
    "decision_time_rule": "One causal setup transition per Pilot variant and ticker-session is frozen at T before any outcome is observed.",
    "completed_bar_rule": "Completed-bar setup features end at T-1; trigger crossing requires separately timestamped current price/quote evidence.",
    "missing_data_rule": "Execution-critical missing data makes the research observation non-executable; contextual missingness remains UNKNOWN.",
    "future_information_allowed": false
  },
  "decision_rules": {
    "implementation_status": "SHADOW_NOT_IMPLEMENTED",
    "setup_rules": [
      "separate versioned challengers for opening-range acceptance, VWAP reclaim/retest, first controlled pullback, and tight-base release",
      "one transition per setup variant and ticker-session; overlapping minute observations are not independent evidence"
    ],
    "entry_or_research_rules": [
      "research observations only; no broker review, risk authorization, buying-power reservation, or order",
      "freeze trigger, limit/chase ceiling, structural invalidation, quote, spread, maximum wait, and cancel conditions at T"
    ],
    "exit_or_outcome_rules": [
      "UNKNOWN until each challenger has one frozen cost-adjusted exit policy and first-passage target/stop/timeout semantics",
      "same-bar trigger, confirmation, fill, target, and stop ambiguity must fail closed or use event-sequenced quote/tick evidence"
    ],
    "invalidations": [
      "support, VWAP, opening-range, or base acceptance failure; stale/crossed quote; failed liquidity; extension/exhaustion; adverse security evidence",
      "any attempted LIVE, PAPER, broker, risk, or allocation action under this SHADOW-only contract"
    ]
  },
  "instrument_scope": {
    "research_only": true,
    "included": [
      "opening_range_breakout_challenger",
      "vwap_reclaim_challenger",
      "first_controlled_pullback_challenger",
      "tight_base_release_challenger"
    ],
    "excluded": [
      "broker_order",
      "live_position",
      "capital_reservation",
      "automatic_promotion"
    ],
    "notes": [
      "Each challenger must preserve causal decision timestamps and be graded separately from the incumbent."
    ]
  },
  "lane_risk_translation": {
    "status": "UNKNOWN_NOT_ACTIVATED",
    "notional_rule": "UNKNOWN; no quantity, buying power, or capital is authorized or reserved.",
    "stop_defined_risk_rule": "Research R is anchored to the frozen executable fill and structural invalidation, never the prior-bar observation close.",
    "stress_loss_rule": "Must include decision-time spread, slippage, gap-through, halt, liquidity, and correlation stress before any promotion claim.",
    "lane_adjustments": [
      "above-$5 and $1-$5 equities are separate evidence lanes",
      "opening 25-minute and later-session transitions are separate time regimes",
      "ORB, VWAP reclaim, first pullback, and tight base remain separate challenger identities or subcontracts in analysis"
    ]
  },
  "cost_execution_model": {
    "status": "UNKNOWN_NOT_IMPLEMENTED",
    "quote_source": "Requires decision-time executable bid/ask and size; stale backfilled spreads are not admissible.",
    "spread_model": "Use causal half-spread or validated fill shortfall on both entry and exit and report quote coverage/age.",
    "slippage_model": "Must include next-event confirmation-safe fill, stop slippage, gap-through, and halt resumption.",
    "fee_model": "Report applicable fees and do not silently assume unavailable costs are zero.",
    "fill_model": "No same-bar full-volume confirmation and fill; use next executable event/bar unless event sequence proves ordering.",
    "maximum_contractual_loss_rule": "Long equity has no contractual stop guarantee; report stress and gap loss separately."
  },
  "session_calendar_rules": {
    "timezone": "America/New_York",
    "calendar": "U.S. equity trading calendar with premarket, regular-session, halt, and early-close handling",
    "research_or_entry_window": "SHADOW observations by declared premarket, opening-25-minute, and later-session regimes; no active broker entry window.",
    "mandatory_flat_rule": "All modeled challenger outcomes end under a predeclared intraday horizon; no overnight transfer.",
    "holiday_rule": "No equity-session observation on a verified market holiday."
  },
  "capital_policy": {
    "allocator": "CENTRAL_DYNAMIC_RISK_CONTROLLER",
    "fixed_module_budget": false,
    "live_notional_range_pct": [
      0,
      100
    ],
    "max_unleveraged_buying_power_fraction": 1.0,
    "leverage_allowed": false,
    "leaderboard_can_reallocate_capital": false
  },
  "record_identity": {
    "required_on_record_types": [
      "candidate",
      "decision",
      "campaign",
      "outcome",
      "grade",
      "pretrade_risk_facts"
    ],
    "required_fields": [
      "pilot_id",
      "book_mode",
      "decision_contract_version",
      "decision_contract_hash"
    ],
    "book_mode_enum": [
      "LIVE",
      "PAPER",
      "SHADOW"
    ],
    "contract_hash_rule": "LOWERCASE_SHA256_OF_EXACT_CANONICAL_CONTRACT_FILE_BYTES"
  },
  "suspension_criteria": {
    "entry_or_research_kill_conditions": [
      "decision-time quote or event ordering unavailable for an executability claim",
      "future leakage, outcome-enriched cohort contamination, or overlapping-observation pseudo-replication detected",
      "cost, gap-through, or halt stress missing from a profitability result",
      "any non-SHADOW book mode or nonzero trade, risk, reservation, or allocation authority"
    ],
    "operator_stop_semantics": "Registered SHADOW research is zero-authority; it cannot alter, release, or bypass the LIVE emergency-entry stop.",
    "automatic_restart_allowed": false
  },
  "evidence_standard": {
    "performance_status": "UNKNOWN_INSUFFICIENT_EVIDENCE",
    "minimum_independent_position_episodes": 100,
    "minimum_trading_sessions": 40,
    "minimum_distinct_underlyings": 30,
    "chronological_holdout_required": true,
    "after_cost_clustered_ci_lower_bound_must_exceed_zero": true,
    "independent_review_required": true,
    "metrics_may_be_unknown": true
  },
  "fact_sheet_rules": {
    "schema_version": "titan_pilot_fact_sheet_2026-08-23_v1",
    "classification": "PRIVATE_TRADER_BRAIN",
    "separate_by_book_mode": true,
    "combined_performance": null,
    "required_metrics": [
      "after_cost_expectancy_r",
      "ticker_session_clustered_95pct_ci",
      "maximum_drawdown_r",
      "profit_factor",
      "win_rate_pct",
      "execution_shortfall_bps",
      "entry_slippage_bps",
      "exit_slippage_bps",
      "effective_independent_sample_size",
      "distinct_ticker_session_count",
      "trading_session_count",
      "distinct_underlying_count",
      "evidence_coverage_pct",
      "policy_hash",
      "decision_contract_hash",
      "known_failure_modes"
    ],
    "forbidden_content": [
      "credentials",
      "raw_broker_payloads",
      "licensed_massive_source_data",
      "cross_book_combined_performance"
    ],
    "authority": "REPORTING_ONLY"
  },
  "promotion_policy": {
    "automatic_live_promotion": false,
    "leaderboard_grants_authority": false,
    "shadow_evidence_required": true,
    "independent_review_required": true,
    "explicit_versioned_authorization_required": true
  },
  "known_failure_modes": [
    "multiple setup labels on one move can overstate independent evidence",
    "opening volatility can make modeled fills unrealistic",
    "parameter search can overfit a small number of ticker sessions",
    "ranking improvements may identify volatility rather than directional edge"
  ]
}
